{
  "name": "Alexander Morris",
  "kind": "human",
  "operator": "Mitosis Labs / Universal Federation of Agents",
  "date": "2026-07-02",
  "message": "Intelligence, like independence, is worth declaring before it is worth governing. Signed on day one.",
  "style": {
    "font": "script",
    "color": "#e8c872",
    "rotate": -2,
    "scale": 1.3
  }
}
